date,text,rating
2014,"I came to Kiraku with my friend because we both like Japanese Izakayas, where you get a wide selection of little dishes and deliciously char-grilled but juicy skewered meats of all sorts.

We came here early, like about when they were just opening around 5pm, and good thing we did, because even though it was an early in the week weeknight, it got crowded later with a waiting list.

When I saw others reviewing a Japanese place this close to campus, I figured it was just gushing Cal students with little experience just happy to have some Japanese flavors that were cheap and nearby. But this was not the case at Kiraku. It is the real deal!

Most of the people here were not students, but older, with a little more discerning tastes, including some Japanese.

I had just eaten a couple days earlier at another new Izakaya in San Jose (Misaka Grill near Santana Row) and it was excellent. But I must say, Kiraku matches or perhaps exceeds some others I have been to for Japa Tapas, and I have been to many here and in Japan.

Perhaps like the South Bay Izakayas of Gaku and Ajito, and to some degree Ippuku, also in Berkeley, the staff is all Japanese, even the waitresses are fluent. This gives Kiraku a little different vibe then the we-will-employ-anyone-who-is-Asian-looking places. They understand the service ethic expectation in Japan, and try to keep up with it here.

They have a great selection of all the main categories of dishes you would like to find in an Izakaya, and they have a good election of Sake and Shotchu as well. The dishes are too numerous to describe one by one, so just look at the pictures and see if they look good to you.

This place isn't cheap, and if you go hog wild with your taste buds calling the action, you can exceed $100 for 2 people, so this is definitely not a place for those on a student budget, unless they are on a diet.

Try out Kiraku and let me know what you think.

As for me, I will be coming back.",5.0
2014,"An amazing Izakaya experience just a couple blocks away from the UC Campus.

I was able to make a reservation there for two, which was really nice, since the place is usually packed. In order to make a reservation, you have to guarantee that you will spend at least $30 per person. Not really that hard to do if you're drinking some of their fine quality sakes.

Loved the sake flights. Got the middle tier ""Kiraku"" flight and followed it up with a ""cup"" of a nice diagingo, recommended by the owner. They pour a single cup in the traditional masu, so you're basically getting two servings as they overflow the glass into the small box containing it. I drank from the masu and my date had the glass.

What set this place apart for me was the attention of the staff. We accidentally ordered a rice dish midway through our meal. The server came by to double-check if we meant to do that, since in a traditional izakaya experience you're not supposed to have rice dishes until the end. We told them it was fine, since we're not purists, but that attention to detail and authenticity really set this place apart in my mind.

Food was excellent and wonderfully presented. There is fare there for the mild and the adventurous. This place is definitely better for groups of four or less. More than that and you'll have to wait an awfully long time for a table, come really early, or make one of those coveted reservations.",5.0
2014,"A Japanese place without sushi. Suspicious.

We went here for a friend's birthday, and I regret not saying yes when the waiter asked us if we wanted sake. This place is pretty pricy, and the portions are small. If you're not willing to take out your wallet, or if you were deceived by the ""Japanese"" classification, you might want to find your California Roll elsewhere. We got the corn tempura, squid, and tofu. My favorite was the corn tempura, which was the perfect mix of sweet and fried goodness. Service was good, and our bill came up to around $30 per person. Obviously, the guys weren't full and declared that they were getting pizza afterwards.",4.0
2017,"I recently visited Kiraku with a friend and the place was a little better than expected. Of course, it would have been better if we had gotten there early as well. Gwas a bit of a hassle, as there were very few spots available and the wait for food can be somewhat anti-climactic. If you're going there with an appetite, then be prepared for the wait. We had a few things there, but the one favourite was the pork belly skewers and their beef tataki. Both very different, but they were good. I would also recommend their green tea ice cream if you're in the mood for dessert. Although the food was relatively alright, service could have been better.",3.0
2017,"Be prepared to dish out some dough, but also be prepared to be amazed. Only comparable place around the area is Ippuku, especially the wait. Make reservations so you don't have to wander around Berkeley for 1-2 hrs. What should you get? EVERYTHING. No, seriously you should come here a few times and figure out what your favorite dishes are. The staff is amazing and super attentive. Let them know what they recommend based off of what you like. Also if you're trynna impress your crush I suggest you take them here, not sure if I mentioned this, but MAKE RESERVATIONS.",5.0
2017,A different kind of Japanese food. No sushi rolls. Some sashimi. Lots of care taken to create beautiful and tastey food. I liked 80% of what we ordered. I like the decor. FYI: tables are quite close together.,5.0
2017,This is a really good restaurant and I enjoyed the uni that was topped atop my snow crab and rice dish. It's slightly more expensive for the amount you are given but the skills needed to make the food are greatly appreciated. I came to the restaurant for my birthday celebration and it was completely worth it.,5.0
2014,"Stopped off in Berkley for food!  Looked up something on Yelp.  I saw this place had 4 1/2 stars after 300+ reviews so my fiance and I decided to stop off.
This place is small yet packs a bunch of people.  They are open fairly late.

When shown to our table after being seated they brought out warm wash cloths to wash our hands with.

Although small, the place has a new twist on the Japanese decor, modern take on traditional design.

Roasted tea is refreshing and light in flavor.

Corn Tempura with green tea salt phenomenal!  So tasty and delicious!  Hot out of the fryer, and salted perfectly!  No need for a salt shaker at the table.

Black pork belly skewer with homemade spicy miso is tasty, even for me a non pork fan.

Jumbo squid cooked to perfection!  Not too chewy, but you know it's cooked through and through.

Wagyu beef tataki, as Wagyu should be, delicate and tasty like the finest carpaccio!

Mini Kaisen donburi has various bits of sushi, very yummy!!!

Yaki udon with octopus and basil pesto is a very new and unique take on Yaki udon!  Me like!!  The bonito flakes on top sealed the deal to make this a Japanese dish and not Italian!  So good!

Oyako don is so tasty, the good old fashioned chicken rice and egg over rice!  Just as good as everything else!

The bathroom is diminutive in size but pleasant with pictures of their food and empty bottles of sake, very simple aesthetics but nice.  If you are an incredibly large person, you will have difficulty turning.

This place is shockingly good and ingenuity to the dishes are unlike I have seen before!  The service is excellent, never leaving a glass empty and accommodating to the personnel and thanked us for waiting multiple times.

I will definitely return when I am back to Berkley!  I would definitely suggest this place to other people!  Let this place be here til I die!  Sooooooo goood!!!!!  The chef has impressed the hell out of me with his/her creativity!!",5.0
2014,"Hands down one of the BEST Japanese restaurants I've been to! It is so good that it's comparable to the food I've experienced in Japan.

It is not a fancy place by it's look. It is small but cozy and clean, and has that Japanese traditional izakaya feel. Service was extremely friendly and helpful. It is wise to make reservations ahead and they do require you to spend at least $30 per person (you can easily spend that much and it's well worth it). They also have a tight deadline that sometimes they ask you to leave at a certain time to accommodate the next reservation. Again, they are very polite about it, and the timeline is more than enough for us to enjoy our food.

So here comes the best part... their near perfect quality and super delicious food!
Here are some highlights:

Sashimi plate: The sashimi special was consisted of fresh scallops, fatty tuna, black tuna, salmon and some other fish that I can't name. And it doesn't matter because they tasted freaking awesome! It's to die for melt in your mouth pure awesomeness! The pieces may not be huge, but they are worth every penny as you savor every near perfection bite. It is like butter, but only 10 times better.

Snow crab broccoli salad with uni dressing: Hello? it's uni dressing, can it be any more exotic than this? The broccoli is fresh and crisp, crab of course is fresh, and uni dressing on top is the last draw to the great texture and taste combo.

Duck: Forgive my Chinese ignorance, but I believe, and always will believe, that Chinese makes the BEST duck. However, these come pretty close. They are juicy, tasty and fatty (in a very good way). This is how ducks should be cooked and prepared.

Battered fried corn and rice balls: These are the must haves when you visit an izakaya restaurant, and they definitely don't disappoint at Kiraku. I appreciate that they add their own special touch to these standard izakaya dishes.  The seasoning is very tasty and the seaweed salt is perfect on the fried corn. They have their own homemade pickles to go with the rice balls which works very well. The pickles are not the usual Japanese pickles I get in super market or Ramen restaurants, it reminds me of the Chinese sour pickles but it has a Japanese spicy twist to it. The rice balls are grilled nicely so you do get that crunchy on the outside but soft in the inside texture.

Grapefruit sorbet: I believe they made these sorbet themselves. It is fresh and super refreshing. It is creamy without being creamy (if that makes any sense). The grapefruit taste is strong but not overpowering. Every hint of citric taste is just right. Perfect way to end the meal.

Sake: Kiraku has a pretty good sake menu with reasonable pricing. The staff made a few recommendations based on our taste, and we enjoyed the drinks very much. It's easy to drink and we didn't get headaches later. FYI, the one we ordered was called ""Dassai"".

It was an amazing experience at Kiraku with top quality food, enthusiastic and friendly staff, and the cozy casual atmosphere. It is a great place to enjoy authentic Japanese cuisine while catching up with friends over smooth sake. I've been to Japanese restaurants that are three times more expensive but they can't hold a candle to this place. It is restaurants like this make you appreciate Berkeley even more. It is hard to locate these types of gems in most other states.",5.0
2018,"Absolutely amazing service and delicious and fresh food!!! Love their thin sliced fish with hot oil, citrus juice, and pepper powder (forgot the name of the dish...). Downside is cramp seating and long wait, but I assure you the food will be worth your time. The desserts were delicious as well, especially the Black Tea Blanc Mange (see pic below) is soooo smooth and refreshing and satisfying!!! Check out their bathroom too haha, super unique decor.",5.0
2018,"We went to Kiraku on a Saturday night without a reservation, and the wait was 3 hours long, but the food made the wait so so worthwhile...

Corn tempura with matcha salt: So good.  How do they make it so crunchy on the outside and soft on the inside?
Garlic edamame: Super savory without being too heavy.  Would definitely recommend
Salmon carpaccio: Probably my favorite dish here, I expected a thinly sliced salmon at first but, to my surprised, got reasonably thick salmon slices (yay) drenched in yummy marinade
Sashimi: We got salmon, tuna, and scallop.  We would have gotten the toro if we could, but toro apparently only comes in the 5-sashimi platter.  Salmon was by far everyone's favorite
Wagyu takaki: This melts in your mouth, if you enjoy eating raw beef in any shape or form you will like this
Black pork belly skewer: Perfectly cooked pork belly, not too chewy. Similar to Korean cooked belly
Black cod: Really soft and easily breaks.  Texture was really great.  I am normally not a huge cod fan, but I enjoyed this dish
Suzuki carpaccio: Another really great dish, we ordered 1 plate initially, finished it, and ordered an extra one...
Wagyu nigiri with uni: I really liked the wagyu nigiri and usually love uni, but there was more sea-flavor in the uni than I would have liked / enjoyed.  Would likely pass next time
Buta Kim: Ordered this after seeing a video on yelp of the egg breaking!  It was okay, would skip next time, Kimchi was too salty
Roasted Duck: Would skip next time... was pretty good, but there was a pretty strong duck smell that came out while eating
Green Tea Ice Cream: Super quality, top notch
Homemade Grapefruit Ice Cream: I expected more of a sorbet but was pretty chunky and had pieces of grapefruit in it.  Served with grape and blueberries and is a really nice way to finish your meal

Service was also very good.  Place is really small (10-12 tables?) and popular, so definitely plan on waiting if you go.",5.0
2012,"Japanese tapas? Ok sorry correction; pardon my knowledge it's called Izakaya. The name ""izakaya"" is a compound word consisting of ""i"" (to stay) and ""sakaya"" (sake shop) (from wiki) and they mean it when you need some sake (or beer, chu-hai, soju, sochu or any of the alcoholic beverage they allow you to order) I did a taste testing here between if you dont drink alcohol with the food and if you did what would be the difference. My conclusion: it tasted much better with alcohol.

Starter:
Tsumami starter:  Baby squid, Takowasabi, and Spicy Jellyfish.
The spicy jellyfish was more sweet than spicy to me with a good crunch.
Takowasabi was a good twist; with chopped up raw octopus and fresh wasabi, it had a salty spicy kick to it.
Baby squid; they weren't kidding when they said fermented. Raw fermented baby squid that you have to be very caution while eating. Put the whole thing in your mouth or it will squirt. It has a nice crunch but lots of juice from the fermentation. Also it's very  fishy taste.

Fried:
Agedashi tofu: Very fresh Homemade tofu covered with corn starch and deep fried served in a bowl of starchy light soy sauce dipping sauce topped with and finely crushed radish bonito flake.

Appetizer:
Spinach: cooled blanched spinach pressed into a cube topped with bonito flakes with a small teapot of dark soysauce (beware of how salty the soy sauce can be)
Iso Chikuwa: two pieces of fried fish cake covered with battered and deep fried then cut into eight 1/4 inch x 4 inch pieces and then stacked covered with a crushed herbal leaf. soft and chewy.

Grilled:
Jumbo Squid: Jumbo squid grilled to perfection glazed with teriyaki sauce. sliced and served with japanese mayo and chili pepper sauce.

Dessert:
Roasted tea blanc-manger: roasted tea panne cotta topped with tapioca and red bean paste. subtle tea flavor with the sweet milky taste of the milk. kind of like a roasted milk tea gelatin.
Sweet potato brulee: creamy taste of the sweet potato kind of like a thick puree with the crispy thin sugar glaze with every bite.

Special:
Roasted duck with Foie Gras: Two pieces of creamy rich Foie Gras lightly fried on each side with tender pieces of roasted duck thinly sliced cooked medium rare. surrounded with a pool of  house special infused sauce maybe made with teriyaki, soy, chili pepper and wasabi. What ever it was it was able to trick my senses.

Food was extra ordinary. Good pricing. table setting were very cozy. Also very good service.",5.0
2015,"I'm so happy we stumbled upon this spot during a Yelp search for a last-minute dinner spot on a Sunday night.

Everything about this place feels genuine to an experience in Japan. The sake cups are handmade by the chef and each dish is prepared with such attention to detail.

The wait can take a long time as the restaurant is tiny! So put your name down on the list and take a stroll.

My only tip is to go out of comfort zone and try something you wouldn't normally get at a yakitori spot. There's also a daily special menu you should definitely order off of.",5.0
2016,"We got here ~6:30pm Thursday night  and the line was already far out the door - we had to wait ~90 minutes which is really pushing it, at least for me. A few urges to leave during the wait, but a note for next time to make a reservation because hitting their minimum spend was not difficult at all.

What we tried:

Sake flight - 3 flight of selection which went very well with the food
5 Types of Sashimi - really great selection that day - kanpachi was the best
Yuba Spoon - delicious and smooth concoction of flavors, fragrant taste the uni, but a bit overwhelmed by the tofu
Corn Tempura - not many places that offer corn tempura - delightful, sweet taste like funnel cake
Chicken Karrage - moist, tasty, but nothing out of ordinary
Chicken Cartilage - interesting for a few bites, but heavy since its fried - would be great drunk food
Fried String Ray Fin - interesting flavor and texture, should try, but only recommend one fried dish at a time
Premium Beef Tongue - probably the best beef tongue dish I have ever had- quality was amazing - enjoyed with the salt though the truffle oil was just a tad too much
Grilled Eel - special of the day, first time having fresh eel and it was moist and tender
Mini Kasien Don - standard don with uni, snowcrab, and ikura
Homemade Grapefruit Yogurt ice cream - definitely unique and refreshing way to end the meal
Roast Tea Pudding - pretty light and tasty - would try if you like pudding / mousse consistency

Personal favorite was the beef tongue with salt and truffle, the fresh grilled eel and the selection of sashimi that day.

Service was attentive and the waitresses were very accommodating and helpful! They gave us good recommendation and helped us matched sake for our meal.

I have had my fair share of Japanese food and izakaya and I have to say this is one of the best I have had in the Bay Area - great authentic selection of tapas with great service. Will definitely return when I am in the bay (this time with a reservation).",4.0
2015,"Place is too busy. Wait time over an hour for 2 ppl.

It's Freezing cold outside and hostess kicked everyone out to huddle under a small propane heater with blustery winter wind.

They should do phone call/txt alerts so ppl don't have to die of hypothermia to get some soup.",2.0
2017,"The grilled jumbo squid, chicken karaage, and sting ray are all pretty good in terms of the tapas. I had chazuke, and I love how the dashi broth comes in a separate tea pot, its so cute! All the toppings are separate so you add what you want to the bowl of rice and pour the hot dashi over.",5.0
2015,"Beautiful gem in Berkeley for authentic Japanese tapas!!! I'm regret for knowing this place so late :(

Make sure you have to make reservation unless you don't mind to stay in line for more than an hour. The restaurant is small and all-time busy.

Price is reasonable and large variety of food selection. Ingredients are fresh and some of them are imported from Japan. Foie gras is on their menu after the ban was revoked. Beef tataki and the seared duck are so decent.

Yuzu mochi is nice as It doesn't taste like artificial. I can't wait for the next visit to try the rest of their menu ;)",4.0
2017,Wow. This meal has left me speechless. Every single thing was amazing. Can't wait to come back!!,5.0
2014,"Came here with my husband on a Friday night about 7:30. Had to wait outside for about an hour to be seated. Very small spot.

After waiting, I had high expectations. Service was on point for my whole experience. From the waitress giving us a warm towel to wipe our hands as we were seated, to the waitress educating us on the food and sake menu, to overall friendly staff.

The food was good. What stuck out for me was the corn tempura and rock shrimp tempura! I wasn't a fan of the broiled beef tongue.

I would return, but probably not at peak time on a Friday night.",4.0
2016,"First time at his establishment.  
Everything I tried was delicious l!!

Oh remember, make a reservation or else be prepared to wait outside for an hour.",5.0
2014,"Came here around 9pm on a Friday evening, and the wait was only 20 mins. We were lucky because it looked like a bunch of tables were just wrapping up. There were quite a few people ahead of us on this list, but it seemed like most of them had bailed (it was a pretty cold and drizzly night).

:: Corn tempura with green tea salt - glad we tried this, but not my favorite dish. it's pretty much what you'd expect a fried bundle of corn to be ;)
:: Pork belly skewer - texture was tougher than I expected; nothing special
:: Roasted duck Kiraku style - tender, juicy, and cooked perfectly
:: Grilled rice ball (onigiri) - I prefer the one from Ippuku, but this one was different, wrapped with a green leaf
:: Grilled jumbo squid - best bang for your buck! tender and delicious. I'd prefer to share this with a group of people though, unless you can't get enough squid
:: Blanc-manger - sweet end to the meal! a light mousse with a roasted tea flavor

This is definitely a gem in the Berkeley area. Great izakaya experience and food at reasonable prices.

I'd definitely recommend grabbing a seat and trying this when you can! FYI, reservations require a $30pp minimum spend. Although the restaurant is quite small and only seats 35-40 people, they can also host groups for birthday parties.",4.0
2014,"I had the chance to come here for a tasting menu that was to die for. I like the casual feel of this place better than sine others in the area because it reminds me of Japan and not the high end feel many places have here.

In Japanese the locations are simple but the food quality is very high. They get it right here.

Oh but get there 20 to 30 minutes before they open or have time to burn waiting to get a seat.",5.0
2017,"Dined there last night. Was great! Loved a few dishes we had. The crab and broccolini was a tad too salty, still delicious. The beef tataki was delicious! The black cod was sweet and savory...exactly how I was imagining. We asked the waitress about the jellyfish which she said was one of her favorites. Not for either of us! It was pretty gross. We were trying something new and looked to her to guide us. Aside from that, the food was very delicious! It is a small place that I almost passed a few times trying to find it. I would recommend this place to any people in the Berkeley area. Their sweet potato crem brle was yummy too",4.0
2016,"Great Tapas dishes. I love their tempura corn and various meat skewers/tapas.

The only negative is there is always a wait of 45 min+ around dinner time. They don't take reservations unless you order 30+ dollars per person so makes it a bit pricey for bigger parties.",4.0
2017,"Apart from the limited seating that fills up fast, the only other problem is the menu which you want to order everything in it. We had a good variety of items -- Wags beef tataki, tuna cheek, karaage chicken, grilled mackerel, tempura corn, salmon mixed rice -- and all were excellent. The real stand outs were the roast duck, perfectly cooked and delicious, and the fresh unagi which was unspeakably toothsome.",5.0
2016,"Can't believe it's my first visit! I guess I got stuck on Ippuku and Sumika, my two favorites in the Bay Area. There's also the fusion-y Gochi for novelty factor, Iroriya, and some of the Korean izakaya's in the South Bay.

Compared to the others, I'd rank it highly but not above Ippuku or Sumika. With the crowded tables, simple decor and loud ambience, it feels a little more traditionally Japanese than Ippuku, which is more like fine food in a hip Tokyo club. Overall impression was that it was a little more inventive than straight izakaya fare, while still tasting very Japanese. I'll need to give it another try to be sure of my rankings.

The particular dishes we ordered came out a touch saltier than expected -- the surprise sauce brushed on the grilled rice ball, and the salty crab with broccolini. I thought all were tasty and would happily have tried more on the menu. We didn't get to the squid, which we often order elsewhere, or the desserts, which we were too full for.

Next time we'll make a reservation. Glad to have this place in Berkeley!",4.0
