date,text,rating
2011,"I have, for all intents and purposes, given up writing on yelp. I rarely feel inspired by most places (not enough to make me want to write about it later). More than that, working in the restaurant industry for quite some time has made me less inclined to review other restaurants in my off time. That's just how it is.

But I feel so completely compelled to tell everyone about Kiraku, a new izakaya in Berkeley that only opened a month ago. The setting is not elegant. It's straight forward in a restaurant space that only seats about 30 people. They have a decent shochu and sake selection, the service is attentive and friendly, but their food is definitely what shines the most in their restaurant.

I would hesitate to describe the food as Japanese since it is not traditional japanese fair. Similarly, I can't call it fusion because it is not the pretentious ideas of fusion we have in the United States. It is decidedly  Japanese because the food uses all the same odd fusion techniques and ideas that have been used in  Japan for years.

The plating and presentation of every dish is superb. This is certainly a restaurant where you eat with your eyes first, but the rest does not disappoint. I've been there twice and have tried probably 1/3 of the menu (this is not a small menu... the first time i just came with a party of 12 people for my going away party...)

Every dish is excellent, but there are some particularly interesting standouts. We've had the fried ginko nuts, the fried garlic, both types of eggplant, hamachi collar, pork with kim chi, oxtail, sashimi, yaki udon, etc. Everything is plated beautifully. Everything is excellent (and for me, the oxtail was the weakest dish). They even have french fries, and the french fries are damn good.

The best dishes I've tried so far (by far) are the pickled octopus in wasabi, the boiled baby octopus, agedashi nasu, and really super fantastic shark cartilage in ume sauce . The shark is my favorite because it's so salty, sour and crunchy all at the same time. It's perfect drinking food and it's not something I could find anywhere else. They even have seared foie gras with daikon. That's so luscious and unexpected and even though I was super full by the time that arrived, I had to eat it because it's foie gras. You have to eat it.

Tonight was the first time I had dessert. We ordered all 3 desserts, including a sweet potato creme brulee, green tea ice cream with warabi mochi and a red tea pana cotta. All were excellent but the pana cotta is so amazingly good. It's not too sweet, the tea is subtle and the additions of coarse anko, whipped cream, tapioca are absolutely perfect.

I'm sad to be moving away from the bay area soon, but I'm glad I got to discover this place before I did. It's amazing, and i hope they do well for many years to come.",5.0
2016,"This is a review of their awful customer service. First time trying this restaurant and liked the good reviews from Yelp. I left a VM asking for a reservation, somebody just called me to advised me that because I was using their reservation system I had to expend thirty dollars per person ......what? Why if I don't liked the food I asked her, she said well we will give you a gift card WTF.., a gift card for what? For another restaurant? I guess the reason is because they are very small if that the case  don't do reservations...that's it! But this rule sucks and I never heard something like this. I will never ever eat there! Thank you for ruining my birthday celebration!",1.0
2014,"Wow. One of the best meals I've ever had.

I'm not an expert on Japanese food but I do eat it quite often.

We were really hungry and nervous that the ""small plates"" style would leave us wanting more. We ordered 2-3 small plates per person and were actually quite full even a few dishes in. More filling than it looks!

Food:
-All of the fresh fish was superb.
-The ribs were delicious and tender.
-The homemade tofu was unusual to my tastes and delicious.
-For something refreshing and light, the cucumber with miso dipping sauce was amazing.
-The only dish we didn't like were the taro potatoes. The taro was bland and the sauce had a smokey flavor that neither I or my two friends liked.
-The chicken udon was only ok. Not worth your time considering the other options.

Ambience:
-You will wait a long time but it will be worth it.
-The place is funky and comfortable inside.

I can't recommend it enough!",5.0
2014,"Been here twice and I don't remember what I had here but I DO remember everything was DELICIOUS.  Possibly everything was so good that I just inhaled it all before taking notice what's really in front of me.  However, I do remember CORN.  Must always get that. Some fried battered corn..... *drools*

Poor review, I know.  I just think they warrant 5 stars. Really, everything was good.",5.0
2015,"Honestly, I am very happy to give this restaurant five stars. I came here for a birthday a few years back and found inexpensive yet DELICIOUS and unusual food and great drinks. Staff was very helpful and service was great.

The seating area is quite small, although that lends to a great place to talk with friends and lends itself to better service.",5.0
2014,"It's a small, cozy Japanese restaurant that serves up Izakaya. Let me just start and finish by saying, ""Holy Deliciousness""!!!! Our dinner included the following items: bluefin tuna sashimi, roast duck, pork belly, mini-donburi & sparking sweet sake. Each item that came to our table was more decadent than its predecessor. But the highlight for me was the mini-donburi: it's served in  a bowl with steamed rice, salmon sashimi, snow crab, sea urchin, ikura with green onion garnish. It was an absolute delight to my taste buds and soul, perfect morsels of seafood in a bowl--I highly recommend it!!!",4.0
2016,"This place is so freaking good. I was a waitress here three or four nights a few years ago because Daiki, the owner, saw how much I wanted to work here. Being the UC Berkeley nerd that I am, I decided to quit once I got a new research position, but I had so much fun here with the staff, Daiki and his family, and cheerful customers. When I got my check for having worked those 3-4 days, I spent it all on one dinner - it was totally worth it. Try the 3 sake sampler!",5.0
2016,"Amazing. There's not much else to say. Beef Tataki is so good, you'll find yourself wanting it even when the meal has ended. So many tapas to try, and so many are highly recommended. Sake tasting also amazing and for a good price (the rest of the menu... not so much, but it'll taste good you won't care) You must have patience though, as many have said.. there's almost always a wait, and it'll take some time. will be back",5.0
2017,This is hands down the best Japanese Izakaya restaurant in the Bay Area. I've been coming to this place for several years and the food quality is consistently excellent each and every time. They are busy and it's small so reservations are absolutely a must or expect to wait for 1-2 hrs depending on the day. The roasted beef tongue in truffle oil is one-of-kind. Incredibly tender and delicious. We typically order 2- one for my wife and I and another for our kids.,5.0
2011,"The service here is superb like any new place. We were waited on by several servers, all of them eager. The chef even came out to talk to us. We got hot hand towels too. The menu items are pretty unique. There are some noodle entrees in addition to all the tapas dishes. The kimchi was super pickled, but I don't know if this is housemade or not. The tempura corn with green tea salt was good. The salt was flaky and very salty indeed, but only the faintest taste of green tea. The dashi broth in my chazuke was bland. It only came dressed with nori, arare, and salmon. The vegetarian version comes with plum instead of salmon. There is only one ramen here and it had a piece of chasu, fish cake, half an egg, and some veggie. It didn't really hit the izakaya feel for me.",3.0
2014,"This place never disappoints! I've been here about 5-6 times now and although it can be pricy for the amount of food you get, the food is so good, I think its worth it (especially for a nicer occasion).

Tonight, the bf brought me here to treat me for an early birthday :) seating was very close to another 2-top so there wasn't much privacy, so it was a bit awkward when the couple next to us were in the middle of a breakup...we tried to ignore it and focus on the food instead.

We ordered:
-dried sardine sheets: pretty good app, not as fishy as I expected and it was very light and tasty
-grilled beef tongue: delicious!! Crispy and caramelized on the outside, sweet and so good!

-Osaka style taro potato: I get this every time I'm here, so its safe to say its one of my favorite dishes here. Nice smokey flavor from the bonito flakes, taro is cooked perfectly...so good we ordered 2 this time!

-homemade yuba- came with roe and uni; I'm not usually a fan of uni but this dish changed my mind! The yuba, roe and uni went so well together I wish I had another spoonful!

-black stripe bass carpaccio- really good, spice was just right and the bass was really fresh. Ordered this because they ran out of the scallops

-pork kakuni- really tasty, egg was cooked to a perfect soft boil and the pork was really tender and rich

-rock shrimp ten-don- really yummy! Rock shrimp were a bit soggy but still had a small crunch. It went really well with the egg, eggplant and rice and was a great way to fill our stomachs at the end of the meal.

Had a great experience and the wait staff was very nice and attentive as per usual. What I have also gotten in the past that I recommend: corn tempura and buta kim. Other stuff I haven't found as memorable (like the kiraku duck, duck pot stickers, chicken kaarage, rock shrimp w/mayo and the fries).

Just a couple of tips: they used to also have bone marrow here but we talked to our waitress tonight who said their supplier unfortunately stopped producing them :( so no more bone marrow here!

If you want to make reservations, be aware that there is a $30 minimum for each person, so it might be better to walk in and just wait it out if there are several parties before you.",5.0
2011,"How's this for high praise?

My wife has eaten here twice and says it is her second favorite Japanese restaurant outside of Japan (her first being Yulala tripadvisor.com/Restaura).

I have to agree that the food was amazingly good, especially for the price. We ordered eight items, and a shared a glass of sake, and made it out for under $80.

We started with tempura enoki mushroom (I think it was enoki), and grilled fava beans. Both served with a small dish of flavored salts for dipping.

The grilled meats (we had duck and pork) were simple but outstanding and we savored each bite of the generous portions.

My wife enjoyed the baby squid (I wasn't prepared for fermented seafood at the time), and the fried ginko seeds would perfectly accompany a beer or sake. The balsamico pumpkin threw us both for a loop....Cold, sweet and soft. But it was refreshing after so much meat and fried food.

Lastly, the yuzu udon, with delicious, fresh yuzu zest. It really finished the meal off well.

We look forward to returning as often as possible.",5.0
2013,"Ambiance: It's pretty small inside, but the food is definitely five stars! It's my favorite Japanese place in Berkeley so far.

Food: The tapas were delicious and well-flavored. They are a bit pricey for the college budget but definitely worth the splurge. We ordered the corn tempura, kimchi pork belly, salmon carparccio, lamb ribs, and the roasted tea blanc-manger for dessert. Every dish had great texture and flavor, and not too salty. The corn tempura was especially impressive. I usually don't like tempura because they tend to get a bit soggy and they feel too greasy in the stomach. However, the corn tempura was completely crisp on the outside, not soggy at all, and the corn inside was very sweet and tender.  The salmon carparccio had a yummy sauce on it and was probably my second favorite.

Service: They bring out the food relatively fast for a filled restaurant, and the waiters are very considerate.",5.0
2014,"So yummy!

Sake sampler
Clam - ok, a bit chewy
Sashimi salad - least favorite. Not enough sashimi in it
Corn fritter - delicious! One of my favorites. must order
monk fish liver - good for monk fish liver
Pesto udon - unique and tasty
Bone marrow - so fragrant lovely
Wagyu beef - good but not special
Scallop - fresh yummy
Oyster uni - great
Agedashi tofu - delioso!
Appetizer picked stuff - interesting",5.0
2014,"Best and most authentic Japanese food I've had so far in berkeley. Left a voice message in the afternoon for reservation and they called me back around 4pm to confirm.
The space is not big. Line is always so long. Food is very delicate.
I had wasabi octopus and spicy squid for appetizer.
Salmon sashimi is very fresh.
Wagyu Beef is so good.
Had Yuzu Mochi for desert.",5.0
2015,"Loved it.  We had no idea what we were getting ourselves in to,  but thanks to yelp we were guided fairly well.  For any first timers,  I would recommend the corn,  pork belly skewers,  striped bass carpacio, albacore ceviche,  the pork and Kim chi thing, but with rice.  And our dessert was Yuku mochi and sweet potato Brulee was awesome.  I wasn't crazy about the octopus like everyone else.  It was good and I usually love grilled octopus,  but it didn't do it for me.  In particular I really enjoyed the sea food dishes.  Can't wait to go back, I mean you know it's good when you're already planning your next visit before you even have looked at the dessert menu!",5.0
2015,"A 74-year old Japanese woman introduced me to this place. It is packed. Mostly with young Asian 20 somethingers. And then a table or two or three of Japanese folks in their 50s, 60s and 70s.

The approach is Izakaya--a Japanese drinking establishment. That means tasty bites and a great selection of beverages abound.

So one way to approach dining here is what do you want to drink? Beer? Shochu (Japanese version of vodka)? Sake? Whiskey? You can even have a bottle keep--buy a bottle; they will put your name on it for those who can treat this place as their neighborhood watering hole.

When it is on the menu, the bone marrow is a must have.

There are usually two to three sashimi options a night; some excellent beef tataki. Some seasonal specialities. Things run from $4 to $18.

All the usual favorites: age dashi dofu; grilled items; ramen, ochazuke.  And there is plenty of crossover for folks not comfortable with this style of Asian food; tasty karage (fried chicken) or popcorn shrimp.  

Great for a group of four to six folks, because then you can really explore the menu.

And don't skip dessert. The blanc mange is a personal favorite, but all the desserts are an excellent note to end a fine meal.",5.0
2013,"9.25.13
I never thought having a visit trip to the win cellar would turn out to be a great spontaneous foodie night adventure. A gem in a wall! Kiraku serves delicious, unique and beautiful Japanese tapas you won't find at any regular Japanese restaurants.

When the server hand us the menu and told us what the daily specials was for the night I was excited that my mind felt like it ran a marathon. So many things to choose so many unique dishes to try. Yet we only ended up making a small dent on the menu ordering things to try.

We start off with the homemade tofu. Definitely different and you can actually taste and imagine in your mind the process of how it's made. Next we had the special sashimi combo. It was divine! So fresh so different then other sashimi places that words cannot describe the texture, taste and appearance that you have to see and taste it for yourself. We then tried the salmon carpaccio, waygu tataki, Tempura corn with green tea salt, Lastly we had the deep fried stingray fin and halibut with plum sauce.

Enough with the drooling! It's a must try! Bon appetit!",5.0
2011,"Kiraku is a great place for those who are 21 and older. There is a huge variety of drinks, but the portions of the foods are tiny since the dining is izakaya style. If you eat a lot, be sure to eat some beforehand.

corn butter - absolutely fantastic, creamy and crunchy
lotus roots chips - unique taste, thin, crispy
hamachi kama - well cooked hamachi with good flavor
agedashi tofu - flavorful and good for groups
jumbo squid -average, nothing special
cartilage - really crunch and oily

I was able to try a lot of different plates since I went with a very large group. The service is friendly and fast. Be prepared to spend a lot as the alcohol and food is quite pricey for the average college student.",5.0
2015,"I love the food here. The only reason it isn't getting 5 stars is because they're iffy about reservations- the place is very tiny and even if you have a reservation, they don't save the table for you. I've had to wait over an hour WITH a reservation to get in.
That being said, the food must be damn good if I'm going to wait for an hour for any place. It's worth it.
Try the whole grilled squid, it's cooked perfectly with a great dipping sauce.",4.0
2011,"Thank you Berkeley for finally opening an authentic and delicious izakaya that served a good selection of Japanese beers and spirits. Portion sizes and prices are typical of most izakaya's, which means small-medium plates for around $5-8 each. As with most izakaya's that I have been too, I recommend coming during dinner/happy hour with a good-sized group of friends so that you can order/try a lot more food. Try to stray away from generic Japanese dishes like agedashi tofu that you can find elsewhere. Izakaya's are known for having inspired small dishes for sharing, that are typically unique to each restaurant. Their menu are updated every now and then; personally, I don't think you can go wrong with anything that sounds unique and interesting to you. My favorites have been:

-Salmon Carpaccio: BEAUTIFUL presentation, wonderful balance of acidic and rich flavors, fish was fresh, sweet and perfectly cut
-ButaKim: Stewed pork belly in kimchi with poached egg. This will make your taste buds explode, so I recommend NOT starting with this
-Shrimp Mayo: reminds of chinese walnute prawns but still delicous
-Omelet Salad: interesting take on okonomiyaki
-Jumbo Squid: succulent, not chewey, a good bite to it
-All 3 Dessets!! My friends and I kind of went crazy and decided to order/share all three desserts offered at Kiraku, all of which were unique and delicious. The 3 are: Roasted Tea Blanc-Mange, Sweet Potato Brulee
Green Tea Ice Cream with Warabi Mochi (MUST GET)

Overall, wonderful izakaya in the east bay, authentic, inspired and delicous. Kiraku will not disappoint!",4.0
2011,"This little Japanese restaurant on Telegraph gave off an overall feeling of being very small and cute. There's not too much space between tables and all the waiters were cute little Japanese girls who spoke Japanese (and English -- no worries on the language barrier when ordering food).

We really wanted ramen so we came here for ramen even though they're known for their tapas. I guess there arn't too many options for ramen besides ryowa in the east bay. Their ramen was okay, definitely not the same as what you would find at a ramen-only shop, but it was decent. We also tried their chicken karaage which was very good! I'd definitely like to come back sometime and try their tapas sometime.",4.0
2012,"We happened to fall into this place last year after a movie, it was around 10:45pm. It was my bday wkd. We had a hard time finding a place due to the time. My boyfriend and I weren't to sure but we did not have many options so we tried Kiraku. Well......little did I know that we would have such a  non-typical Japanese dinner that I LOVED!!!! the owner came out and gave us some sake (from his personal stash) that I will never forget. The waitresses are so pretty and sweet, you do not have to ask for anything. We ended up staying until 2:00am and had a great time.

We have returned several times and have not been disappointed.

Please see my pics of the bday desert plate that they served me, it is like a art plate. The whole place sang happy birthday....blush.....

I LOVE THIS PLACE!!!!!!!!",5.0
2011,"What to get..
Kim chi (best I've had)
Balsamico pork (boyfriends fav)
Tempura corn (a must)
Ceviche (necessary)
Tempura garlic (so good but hot breath)

Also...
Had the tacowasabi not awful but but wouldn't order it again.

Sake tasting a must!
Service was good. I would come back for sure.",4.0
2016,"If you are interested in having a reservation somewhere, this isn't the place. I started calling 8 days before date that I was trying to make a reservation. I missed the first call back and they wouldn't pick up when I called back (so I left message number two). They never responded to message number two. So a few days later I left message number three. Two days after that I got a return message asking me if I was aware of their minimum order policy. The same policy that I was forced to listen to every time I left a message. So yes, I'm well aware of the policy and had planned  to order much more than the minimum. So I call back again, leave my fourth message saying yes, I understand the policy, please call me back and confirm the reservation. The next call that I get is one saying sorry, we are already booked at that time, you can come at 8:30 instead. Clearly they had zero interest in my business as they knew for 8 days that I was trying to make a reservation and preferred to give the time away to someone else. Great service! I won't be wasting any time or money at this place. There are lots of restaurants out there with great food that actually want business and don't play games with reservations.",1.0
2013,"Curry croquette was surprisingly good, it was dense and flavorable.  Rice bowl is ok.  Ramen, the soup was super salty.  the noodle is not so good.   Kama, not fresh at all and salty.  Got fishy breath after eating...  Duck dumpling, cant make out what I was eating, I just know its minced meat.   With the sauce, it was very salty.  Fish liver, it was ok.

Service very good.   Overall, dont think I am coming back.  Taste is not there for me.",3.0
2016,"Great place for authentic Japanese tapa venue.  The place is small but cozy, and the service was prompt and attentive. The menu features good selection of sake and soju as well as good mix of meat and fish dishes. Also, don't miss the daily special featuring dishes such as tuna cheek or tuna head in a hot pot. Overall, the food quality is high and the preparation and presentation of the food is superb.  I will come back.",5.0
2011,"Foie. Gras. Daikon.

Modern Japanese cooking is much more than your run-of-the-mill tonkatsu and sashimi. Through the ages Japanese cooks have embraced ingredients and styles of many different lands (check out the origins of Japanese curry, or the etymology for ""tempura""), with the results being the delicious dishes like the ones served at this restaurant.

Creative French-inspired dishes, friendly staff, fantastic sake / shochu selection, reasonable prices. The decor is somewhat pedestrian, but it just makes it easier to make it a part of the regular circuit.

In the East Bay, there is a renaissance of Japanese dining in progress: Combine with Ippuku (Berkeley) and B-Dama (Oakland) for the trifecta.",5.0
2013,"Kiraku is hands down my favorite izakaya joint in the Bay.  My only complaint is that they're not open everyday but I guess everyone deserves their rest.

Great vibe and a perfect size to keep an intimate setting, though I'm sure 5-10 more seats would do them wonders.

Everything on the menu is pretty dam good.  My favs include:

-Beef tongue with truffle oil
-Bone Marrow
-Black Miso Cod
-Chicken Karage
-Homemade Tofu
-Rock Shrimp

They have a decent selection of sake and beer.

Dam...listing this down makes me want to go back soon!",4.0
2015,"Exquisite flare and an array of delicious food makes this place a must dine in. My amigos, have some patience; if the line is out the door, wait n wait until somebody gives in because the hype is that good...The wait was a mere 2 hours, but the familia endured through. The pictures looks appealing, the smell aromatic, and the satisfaction afterward left nothing, but memories of what exceptional food ought to be. Fantastico!",4.0
2016,"I really enjoy this restaurant. However, their reservation policy discriminates against individuals who do not consume alcohol.  They won't give you a reservation unless everyone in your party orders alcoholic beverages.  There are many reasons, socially, religiously, legally and medically why an individual cannot or will not consume alcohol. I understand the concept of an izakya but if we exceed the minumum per person  ($30) to make a reservation, I don't understand a policy where we are forced to ""enjoy their alcoholic selection.""   What are the pregnant women, under-aged, recovering alcoholics, or people who simply make a life choice to not drink alcohol expected to do?",2.0
2013,"LOVE LOVE LOVE. :)
It's a small place, so sometimes it can be super crowded, especially when all of the Japanese business people go there after work. A little pricey, but it's expected for a tapas style restaurant, and for the food quality and overall deliciousness, it's worth it.

I'm a sucker for noodles and I love both of their udon dishes (the pesto udon and the yuzu chicken udon). There is a seasonal menu as well, and as a rule of thumb, you should always get at least one item from there :D Also really like their corn tempura, and the grilled squid.  Dessert wise, I'd go for the roasted tea...thingy, or the grapefruit ice cream :D This is one of the places I always want to visit any time I'm back in Berkeley.",5.0
