date,text,rating
2017,"Definitely make a reservation!! We didn't realize that was a possibility until we were already queuing outside on a cold December night. Apparently you need to commit to $40 per person in spending to reserve; I initially thought that seemed high but it's pretty easy to spend $40 there.

We ordered a whole bunch of items, including a couple of daily specials which included the 5 piece sashimi (which you can't order one serving of - each person has to get five pieces) and the steamed fish, and the chicken karaage, the fried corn and pork belly. The items are nice and tasty bar snacks and certainly the kind of food that's even better with beer and sake. The steamed bass and the fried corn were my two favorites.",4.0
2018,My wife and I love this place and we go here at least once a month. Everything on the menu is just fantastic...from the yuba spoon (salmon w/uni) to the wagyu beef tataki to the always delicious sweet potato brulee. Five stars + five yuba spoons!,5.0
2017,"Four of us went here on a Saturday night and had a blast. Everything we ordered was delicious. Our server could have been more attentive. I do not like running out of alcohol when I still have food.

The only reason I am not giving 5 stars is because they took a party of four that was under us on the wait list into the restaurant before us. I can't think of any reason why they would do that except they must have been regular diners there.  If you have all the time in the world to wait to get in it's worth it. I think we waited close to 3 hours to get in.",4.0
2017,"This restaurant is the typical Japanese Izakaya you can find in Japan, but not in the US. Pretty small, but cozy. The quality of the food was very good, and I feel they didn't cut the corner for the food and even for the dishware. We were able to choose the type of  ochoko (small sake cup) for hot sake!  I'm so glad to find this place even though we had to spend over $40 per person in order to make a reservation. We didn't want to wait outside for a long time. The line was so long. We come back again sometime!!",4.0
2016,"Food: SUPERB! This place is probably the best Izakaya Japanese restaurant I have ever been to in the East Bay area. Seriously, whatever you order here will be good.
I have come here multiple times, from 2 people to a group of 14, this place just never disappoint. Almost every item is good for sharing. Might be on a pricy side (depends on how much/ what you order), but it's definitely worth every penny.
If you are visiting for the first time, I would recommend the takowasa (octopus with wasabi) for appetizer. Main dishes: corn tempura, sashimi salad, yuba spoons (ikura, uni and tofu), buta-kim (sliced pork belly with kimchi and poached egg on top), yaki udon (udon with a special pesto sauce), black cod and beef tongue with black truffle oil. It is great to end a meal with their homemade grapefruit yogurt, since it's very refreshing. Their cheesecake cubes and roasted tea blanc manger are also great desserts!

Tips: This place is pretty small so you should make a reservation. If you didn't make a reservation, you should come 15-30minutes before it opens to secure a seat. If you come any other times without reservation, it the wait can be up to 1 hour. We came at 9:45 pm once on a friday and the wait was 30 minutes.",5.0
2018,"I was very excited to try this place. We waited an hour for a table, once we sat down an ordered based on our servers recommendation.  It took us about 45 mins in total to order and eat our dinner and dessert. After paying we were finishing our conversation and our cup of tea and the hostess asked us to ""please get up from the table because we gave customers waiting outside"". We were appalled! We just spent $100 on dinner for 2, and within 5 mins of paying we were asked to get up. We will not be returning",2.0
2015,"I've been wanting to try Kiraku for quite some time, but after reading about the long wait times, I've kept putting it off.

After finishing one of my final's fairly early, me and the BF decided to go to Berkeley for dinner, knowing we could arrive at Kiraku right when they opened and not have to wait. However, we were verryy early so decided to grab drinks at Triple Rock and wait till 5:30. Our mistake, we ended up getting full off the beer. But since I only wanted to try a few dishes, it ended up working out. Going to Kiraku on an empty stomach would have been $$$$$$$$$$$$$

We ordered:
Yuba
Jumbo Squid
Daily special of scallop and toro sashimi
Foie Gras Daikon
Mini donburi

The Yuba spoons were good. I mean tofu skin, ikura, and uni?! You can't really go wrong there. The flavors were light and went well together. The jumbo squid was super tender! The scallop and toro sashimi were fresh and delicate. I did wish the toro was fattier. The foie gras daikon was a disappointment. Its an interesting concept, and I enjoyed the flavors of the sauce with the daikon, but felt there was too little foie gras for the price. The mini donburi was very mini (but about the price of regular donburi) and it was just okay. Pretty though!

Service was standard and the food came out fairly quick.

I wouldn't worry about the price minimum ($15 per person for walk in and $30 per person for reservations). You'll definitely hit it. The price for these 5 small dishes were $85 before tax and tip. I couldn't imagine if we came here starving!",3.0
2017,"The sea bass carpaccio was delicious..

Surprisingly the octopus was not bad, it's slimy and looks gross, but has a good wasabi taste..

The grilled squid was pretty good.

The corn was so so, wasn't a huge fan.

Salmon sashimi was soft and melts in your mouth.

The mini kensai bowl was so tiny, cute, but wasn't a huge fan.

Mackerel was fishy smelling, but it did have a good sear on it.

Fried chicken was not bad, too much oil though.

Ordered a ton of food, and all weren't bad.  

Beef tongue and pork belly was too chewy, so didn't like it.

Broccolini with snow crab, was ok, the taste of the snow crab was too fishy.

Oyako tasted like chinese ginger chicken.

All that food for 4 people was about $150.

There's a long line after 7pm, so come early. If you make a reservation there's a limit you have to spend per person.",4.0
2018,"The dishes here can add up but it's a great spot in Berkeley! Be sure to get there around 5 when they open up the waiting list so you're not there forever.

The takowasabi (octopus in wasabi) is great if you LOVE wasabi. I was personally not a big fan. But the octopus was fresh and my friend greatly enjoyed the wasabi flavor.

The pork belly skewer was a little disappointing, but it's pork belly and what can you expect. So wouldn't recommend it because I don't think it's worth it, but if you're a fan, it's not bad!

I AM IN LOVE WITH THE GREEN TEA SALT CORN TEMPURA. I get it every time I'm here. It's so good. Just do it, no regrets at all!

Agedashi tofu is also one of my favorites!!! The soup is nice and flavorful, but not too much and the tofu is so soft with a nice tempura on the outside.

The broccolini with rock crab dish, must be seasonal, but it was a tad disappointing. Not a lot of crab and too much broccolini (which I love) but not when I'm paying lots of money for it.

Albacore tataki was also pretty good. I'm not a huge not-fully-cooked fish person, but I still really enjoyed it. Great flavors all mixed together with a light sauce and fresh albacore made it delicious.",4.0
2017,"I've had this restaurant bookmarked on my Yelp page for a long time, and last night we were finally able to go enjoy it!  It's a small restaurant, and you either have to make a reservation or wait.  I called to make a reservation - and basically played phone tag and had to make, and confirm, my reservation based on voice mails.  I started calling on a Tuesday, and was able to confirm a Friday 5:45pm reservation, with a mimimum order amount of $40.  Parking takes time as well since you are doing street parking in Berkeley - so just bring patience if you need to park and wait for a table.

We ordered:
Sake sampler
Appetizer sampler - my husband picked some type of picked vegetable (cucumber?), and octopus dish and I think a third octopus dish (I don't eat octopus but he finished it off so i assumed it was delicious)
Sashimi 7 piece special - very fresh, my husband loved the baby squid and the slices of  squid rolled up with some type of leaf.  The salmon sashimi was excellent.
Yuba spoons - really good combo of uni and roe
House-made tofu - I'll order this again!  I personally loved it - simple flavors but very good.  The house-made tofu was served with sides of chopped green onions, salt and sesame seeds
Corn Tempura - simple, unique and very good, I will also order this again
Agedashi tofu - my staple, I love Agedashi tofu.  The tofu was good and friend well, although I found the sauce it be oddly thick (but it tasted good)
Pork belly yakitori - very, very good grilled flavor.  If you're into pork belly, you better order this
Grapefruit sorbet - Both this and the green tea ice cream came in much larger scoops than we anticpated - my husband really liked the flavor of this, and it was marked as house-made
Green tea ice cream with mochi, red bean and cream - always yummy, and the mochi was very soft and fresh

We really liked our meal here. As usual, my husband and I (he, actually) ordered too much, but we ended up stuffing ourselves and finishing it all b/c it was so good.  I'm pretty sure we'll be back!",5.0
2018,I thought the place was pretty average. Maybe my tastebuds are super spoiled since it has been set to Las Vegas standards? I don't think I'll be coming back.,3.0
2015,"This place is delicious! I came here with two of my friends and we pretty much just went down the menu and tried to order at least one of everything. We ordered: uni and ikura spoons, takowasabi, corn tempura, kiraku salad, buta kim, roasted duck, saba shio, wrapped salmon,  and three skewers: beef tongue, pork belly, and beef sirloin.

I definitely recommend the uni and ikura spoons, wrapped salmon, and roasted duck. These dishes had their own unique flavors and I would definitely get them again. The takowasabi was interesting as well. It's basically raw octopus mixed with wasabi, but it was a bit overwhelming for me. In my opinion, each piece had a lot of wasabi so it was good that it came with really small pieces of tako to prevent myself from tearing up or crying. I would pass on the buta kim. The dish is made up of kimchee, an egg, and bits of pork. While looking at the dish, you can barely see the pork let alone taste it. Unless you LOVE kimchee, skip it.

It's a bit pricey here and if you want to try a lot of different things, expect them to add up. Although the place is super tiny, they have a lot of different flavors and textures. I'm craving to come back already!",5.0
2017,"Fantastic fine on our recent SF/Napa trip. We stayed in Emeryville. It was a Friday night and we were looking for a nice sushi place for a late dinner. This place had great reviews and was only 10-15 mins from our hotel. After reading all the reviews we know it's a small place so we were expecting a long wait. We arrived just after 9pm. Signed our name on the clipboard. There was only 1 party ahead of us. Total wait time was about 15 mins.

We have places very similar to this back home in Las Vegas so we knew what to expect. It's Japanese tapas so it's small plates meant for sharing and trying many different dishes. 3-4 dishes per person.

Husband and I got 2 carafes of Sake, 7 pieces sashimi sampler, uni & salmon roe on spoons (forgot the name), roasted duck breast (only dish we didn't care for), pork Belly skewer, beef tongue skewer, beef tataki, Waygu beef w/ foe grais, waygu beef w/ uni, Uni on crispy rice w/ teriyaki sauce. Our total bill came out to $167 before tip.

Everything was amazing with the exception of the duck. Everything bite was fresh, delicious and full flavor. All in all it was a great dining experience. So glad we found this little gem. Thank you yelp!

Recap...
It's small, it's loud, it's busy, the service and food was to die for. Must try!",5.0
2016,"Finding this Japanese restaurant is not going to be difficult. Just look for one that has people on the outside waiting and you'll find exactly where it is. There are two Japanese restaurants located on the same block where Kiraku will be. On busy nights just like the one where I went, parking may be a little difficult. So plan ahead. It may also be wise to make reservations. It took me and my friend an hour wait just to get seated and may I say it was all worth it.

Kiraku, just like most of izakaya restaurants in the south bay area which I am more familiar with, is a small Japanese restaurant packed with even smaller tables inside just like how it is where this native style of food serving comes from. It smells like different kinds of grilled, roasted, and braised meat plus soups and awesome goodies with nori inside. You know right away that when you're done eating, you'll  smell exactly like what you ate.

It is nothing different inside than any other Izakaya restaurant. However, the food and service deserve nothing less than five stars. It would be very unfair to give them any less. Order any sake and they present you with a selection of your own sake cups! I find it very personal and unique. Come and celebrate somebody's birthday here and surprise them, the lights turn off and all of a sudden everybody sings Happy Birthday. Since the place is very enclosed and not very big, all of a sudden everybody is your family and you are being celebrated!

Now onwards to the food. I figured that instead of the grilled Angus beef, I would try to order the premium braised Beef tongue with truffle oil and roasted salt. Ordered the salmon carpaccio, dried fish (not the unagi), ceviche, roasted duck Kiraku style, Kiraku salad, plum chazuke, edamame, pork belly skewers, pork intestine skewers ... the food was arriving endlessly and they didn't disappoint. Salted just right and the meats appear really tender. The ham from the Kiraku salad was tasty and delectable.

When in Berkeley and if a fan of izakaya, Kiraku would be THE place to go. I definitely heard one of the groups waiting outside say, ""This is now our favorite Japanese restaurant!"" to one of their companions. I don't blame them a bit.

Despite of this vagrant that kept hassling each group waiting outside then started smoking and blowing smoke as if it was pineapple-flavored hookah, the wait was definitely worth it.

The atmosphere inside is noisy, as the tables are very close to each, other but it wasn't loud enough that I was able to notice the nice jazz music that played. Ah...

Close your eyes and savor every dish. My favorite during my visit here was the dried fish. They have moist towels for you to clean your hands with before dining so feel free to eat with your hands !

I'LL BE BACK ! (With reservations!)",5.0
2017,"The more the merrier !
I came with 3 people, next time I'll bring more.

The small portions make it fun & easy to share. Everything is so delicious & unique.
Ordering a majority of the menu was the right idea.

You can't be picky, enjoy every bite.",5.0
2015,"Short Story:  A good place for Japanese Tapas!
Long Story:  I came here on a Saturday evening for Japanese Tapas.  The place is really small and even though we got a reservation at 7PM we waited until about 7:30pm to be seated.  The menu is somewhat extensive with lots of things to try and eat.  Feel free to order lots because it'll take a lot to get you full.

The good thing is that for the most part the food does not take that much time before it comes out.  We ordered lots of diferent types of food...see the pictures for details.  Although what I will say is that this place like most other tapas places can be pricey...be ready to spend three digits with 2 or more people!

Verdict:  Saving up more money for next time...!",4.0
2017,"What an amazing experience! Kiraku was a serendipitous find for us when we stayed in Berkeley trying find a decent dinner spot. Coming here we had no idea how high demand and popular the seats are here. The place opens at 530 pm but there was a crowd of people waiting 30 mins in advance with most of the locals knowing to have reservations. We did not make reservations... but we were lucky enough to make the cut. By that I mean that this place , once its seated at capacity of about 50 people it will close its doors until 7 pm for all those inside to comfortably order and eat.

Now we made it in just on time for the waiting list. those who missed the wait had to wait 1-1 and 1/2 hour to be seated for the next dinner round. But just having had the experience here I highly recommend waiting.

Kiraku is an izakaya styled restaurant or you can say a japanese tapas bar. You come in and they give you a 2 paged menu of what is offered as well as a selection of the specials for that evening. Each dish can run from 4-15 dollars and they are all uniquely delicious. There is also a sake menu.

The options are plentiful and you really should just go to town on the menu, ask for recommendations and go for things that sound appealing. you can easily get lost ordering 5-10 things here. Some of the most memorable dishes were the corn tempura, wagyu beef, grilled squid, black cod, tuna cheeks, and the udon. All were just delicious.

If you're in berkeley or just visiting you definitely need to come to kiraku.",5.0
2017,"Make sure to get there around 5:30 or you'll end up waiting a long time for a table. My bf and I got these dishes and it was just the right amount of food for the two of us:

* seaweed
* pork belly skewer: a bit oily but super good!
* shrimp ten don: the shrimp was soggy not crispy but everything else was pretty yummy
* corn tempura: I really liked this dish!
* agedashi tofu: really yummy!
* omelet salad
* green tea ice cream: the ice cream is very creamy and comes with a green tea mochi and a red bean thingy that I'm not a huge fan of.",5.0
2018,"Excellent food and service. I've been there twice and both times have been superlative. The sake selection is extensive and service steers you in the right direction with both food and drink. The pickles are delightful, the spiced jellyfish was an unexpected thrill in taste and texture, and I loved the seared spicy cod roe. The chef sashimi platter was a large platter of pristine, jewel-tone fish. The black cod was among the best I've had recently. I wanted to turn my nose up at the corn tempura but instead we ordered it twice...We finished our feast with a simple and comforting ramen dish. Then in a moment of gluttony we ordered the mini kaisen donburi instead of dessert. Then we ordered the sweet potato brlee as second dessert- great texture, less-sweet variation on the usual crme.

Waddled home in a happy stupor.

Definitely worth reserving, as there were lines out the door. Reservations require $40/person minimum which includes drink.

PS In case you're wondering how this compares to Ippukku, for me Ippuku offers a more sensuous space but I'd give Kiraku the edge when it comes to the food.",5.0
2017,"Seriously the best restaurant meal I've ever had in my life. Beef tongue skewers, steamed snapper head, tsumami starters (takowasabi!!!), were HEAVENLY.

The reservation via phone was not so responsive (they called me back the next day) but it was well worth it. Service was brisk and efficient.",5.0
2018,This place does not follow their waitlist fairly. People who had barely arrived kept getting seated in front of us for no apparent reason (they did not have reservations). Do not come here if you want to wait almost 3 hours. We left after 2 hours and 40 minutes of waiting and watching people shamelessly cut the people on the waitlist.,1.0
2017,"This is a MUST TRY! I've been here several times on different occasions within the years and they never disappoint! So far my favorites are the Canadian Black Pork Kukuni (something along the name of that) and their Foie Gras on the daily menu with grilled rice and mushrooms. They have a staple menu but I highly suggest exploring their changing daily menu!

The place may have a long wait but it's worth it. Last time I went we has reservations which made it even better! Please keep in mind there's a minimum for reservations but it's very easy to get to that limit!

Thank you Kiraku for making my birthday and anniversary such a wonderful experience! Actually it's always a great experience!",5.0
2017,"Easily a 5 star--the best Japanese restaurant in the Bay Area. My friends and I had to wait for an hour and a half to eat here, but it was definitely well worth it.

PROS
* amazing selection
* every dish tasted fresh and delicious
* every dish that they brought out had their own unique taste and identity to it. When you eat it together, the tastes compliments each other
* I personally don't like eating raw fish, but their salmon sashimi was extremely appetizing
* staff was very friendly. You don't feel forgotten even if the restaurant is busy
* one of the best experiences we've had in a Japanese cuisine
* highly recommend if you aren't afraid to spend money on high quality Japanese tapas

My recommended dishes
--garlic edamame, agedashi tofu, salmon sashimi, ramen, wagyu beef tataki, kimchi with pork belly, blue fin tuna cheek steak",5.0
2018,"Good food.  Good sake list.  You almost can't go wrong.  If you know the owner, like the table next to us, you can do as you please and stay as long as you like.  If not you can pay $100 and be asked to leave a few minutes after your hot tea has arrived so they can serve the next customer.  That's how this place rolls.",3.0
2017,"Tucked away on Telegraph, it's hard to miss Kiraku because there is always a large group of people waiting outside! The inside is tiiiiiny - so the tiny tables are super close together to seat people.

Service is great - because they're trying to get you out quickly, they are super responsive and helpful. Food comes out fairly quickly.

The yummms:
-Grapefruit yogurt ice cream (10/5): that's right - save some space because you will want to be eating this light, tart, amazing ice cream.
-Corn Tempura (5/5): what?! it's a hunk of kernels of corn, fried, topped with a mysterious green tea salt.. it's amazing.
-Oyakodon (5/5): my absolute FAVORITE. Smooth egg, juicy chicken, perfect rice.... mmmm.
-Fried garlic (4/5): super good, these are literally cloves of garlic fried. The miso sauce on the side is pretty good.
-Black pork belly skewer (4/5): also amazing, well cooked, and flavorful
-Yuzu udon (2/5): not my favorite broth, it has a weird window cleaner after taste because of the yuzu citrus",4.0
2019,"Amazing food! Some of the best food I've ever had in my LIFE. Small restaurant, so definitely  utilize the waitlist feature on Yelp.",5.0
2017,"The wait here is insane. I got here at 5:30pm on a Sunday when they opened but was already late for putting my name down as there was already a line. We didn't get seated until 7:45. We were also asked if we could finish in 30 minutes because there were still a tremendous amount of people waiting. I noticed one guy got guaranteed seating even though he wrote his name down pretty late after us just because he was one of those demanding snobby customers with an attitude, so they put him ahead of people for the time he was promised. But anyways, the food here was pretty good. We got the salmon carpaccio, 5 kinds sashimi of the day, roasted angus beef tongue, mini donburi, wagyu beef tataki, and Wagyu nigiri with uni. I enjoyed everything we got except for the roast beef tongue, was kind of salty, had no other kind of flavor to me and I just didn't like the texture of tongue in general. The salmon carpaccio was amazing and was probably my favorite for the night. The sashimi was super fresh and unique, I tried fish I've never had before like red snapper, etc. The donburi was nice, you could taste the quality and freshness of the ingredients. Overall, this dinner flavor wise was top notch, but for the value and worth I'd wouldn't come again unless it's for a very special occasion. Next time I would also get a reservation. Don't even worry about their $100 minimum or whatever you're gonna hit it trust me. I really enjoyed the coziness of this little restaurant though, and plus we managed to finish within 30 minutes like they asked. Our bill came out to be around $120 for two people which is pretty pricy for me. If you're considering trying this place, I would also consider looking into gochi Asian fusion tapas in cupertino because that's where I'll be headed to for my next tapas place! Peace.",4.0
2017,"Definitely on the pricey side but worth it! It's one of my favorite sushi restaurants in Berkeley. I've been here several times and my favorite items to order are the tempura corn (served in 2 peices), roasted duck kiraku style, the sashimi, and the jumbo squid. I've tried the ramen as well as the Yuzu Udon but I wasn't super impressed by it. It was a little bit plain and the flavor was alright. For drinks, I recommend the Capico Chuhai, fuji apple sake and the Oolong Chuhai. The service was great and the waitress always came by to ask if we needed anything. Overall a great experience, but be prepared to wait at least an hour or so on a Friday night. If you are really committed to coming here, I suggest making a reservation beforehand to skip the line. I wish I had known this before waiting!",5.0
