date,text,rating
2019,"My girlfriend decided to take me out to Kiraku for dinner and I was not disappointed. Although the portion sizes weren't the biggest, I felt satisfied with everything we ordered as it really displayed the use of high quality ingredients (freshness + taste) while maintaining a good presentation (plating) of the restaurant's food. Anyone who has been to Japan would probably agree that Kiraku's food is very reminiscent of the food in Japan. Maybe not entirely the same in terms of keeping the food menu traditional, but still close in a sense that you're able to eat such fresh tasting raw fish at their establishment (something most Japanese restaurants have trouble with considering the fact that the availability of fresh fish in the US is harder to come by compared to Japan).

Useful Tip (Must): For people interested in eating at Kiraku, I suggest you come in early and sign you + your party on their waitlist. The restaurant doesn't open until 5:30pm but while the restaurant employees set up they leave an iPad outside of their restaurant for people to sign up for their waitlist. My girlfriend and I got there as early as 4:40pm and we were able to get the first spot on the waitlist. By checking in on their waitlist, it allows you to receive text updates regarding your place in line. As soon as we came back (around 5:10pm) the expected wait time was 91 minutes. So try your best to come earlier than the early people ^^

The establish is really small and they cannot accommodate too many at once. It's recommended that bigger parties reserve a table by calling in a couple of days in advanced or expect to wait a long time. Another reason why the wait is so long is because everything you order does not come to your table all at once because they like to serve their food to customers plate by plate.

No complaints on service, every employee was friendly and informative about their food menu.

Personal Favorites:
Black Pork Belly Skewer w/ Homemade Miso
Tender Beef Tongue Skewer
Wagyu Uni Nigiri
Yuba Spoon

These are all my personal favorites at Kiraku! I don't want to go in too much detail of each dish's flavor because that would only spoil and ruin the experience for everyone. Instead, come out and check it out for yourselves (:

Would I eat here again?
I feel like Kiraku is more of a place you go to only on very special occasion and to me it's more like a place you go to for that one time experience. I admit the food is good but the prices are really high for the portions you receive. It's not a practical place to go to if you're trying to get super full. However, it's a restaurant that everyone should experience.",5.0
2019,"Small hole in the wall izakaya with trendy reggae music playing.

Came here for my birthday! Rave reviews on yelp brought us here. They do sing to you while you eat dessert- but you do have to pay for it, not complimentary.

For the 3 of us we made a reservation and were seated immediately

Excellent quick service--

1 solid star off- too salty for the skewer meat
The albacore ceviche was great but again lime was a tad too much One star off the grilled meat was a tad too salty for our tastes buds.

Good dishes :
Beef tataki
Grilled squid (must order if you like squid)
Chazuke

Servers were so attentive at refilling our tea and water.. much needed given the saltiness of the food.",4.0
2019,"Found this spot on yelp and wanted to try! There was a little wait so we added ourselves on the Yelp waitlist. The service is excellent. Our waitress handed us a warm towel to wipe our hands. The menu is pretty limited so it took my friend and I a little while to ordered. We ordered the Waygu beef tataki, sake sashimi, and chefs special.

The beef tataki was delicious but very thinly sliced. It was good enough for you to taste the texture of it.

Salmon sashimi is fresh, but the amount is a little a skimpy for the cost.

Chef's special was catfish with their home made sauce or some. We ordered some rice to fill us up a little bit.

Great food, great service but need to be more generous with the portion. Street parking can be a little rough. Make sure to check in on Yelp before coming by!",3.0
2019,"I should've known better that Yelp Waitlist is available at many restaurants nowadays and that I should always check before I leave the house. I waited 1.5 hours for a table for 2 on Sunday night, crossing my fingers that I'd be seated before they close at 9. Good thing for me, luck was on my side that day and I was seated with an hour to spare before they closed. Make sure you check-in once you get the text because at one point, I got booted off the waitlist and had to be re-added.

I've heard many great things about this place and I was excited to take my mom to a new restaurant in Berkeley. Fortunately for us, when we started waiting neither of us were hungry. But, by the time we got seated, we were friggin' starving so we obviously ordered way too much food for two people, but hey, BALL OUT.

Kiraku is famous for their high quality tapas or small dishes and they're great for sharing. The price point for items is anywhere between $3-18, more if you're ordering premium daily specials like their sashimi plate. It adds up rather quickly if you're not careful.  

SASHIMI SPECIAL
Comes with 3, 5, or 7 types of fish, one piece each starting at $11.
Super fresh, thick and sweet cuts of fish

SUZUKI CARPACCIO
One of my favorite items of the night, thinly sliced fish with japanese soy sauce, yuzu and sesame oil.

YUZU CHICKEN UDON
Honestly ordered this because I thought we weren't going to be full, but it's pretty basic. Soup is citrus-y and very refreshing. Chicken wasn't anything special.

MINI KAISEN DONBURI
I love all things salmon, ikura, snow crab and uni. It's a cute little Donburi bowl with the best ingredients.

TENDER BEEF TONGUE SKEWER
I love yakitori and one of my favorite pieces has to be beef tongue. Then of course pork belly, cartilage and other fixin's like heart and gizzards. But only tried one this time. If I was more baller, I'd try the Beef Tongue with Truffle Oil. Maybe next time.

JUMBO SQUID
Best grilled squid I've had at a Japanese spot in the East Bay. Perfectly grilled, not chewy at all, flavors were great. Served with teriyaki sauce and a side of Japanese mayo.

SPICY TUNA TARTARE
Prepared Temaki style, so you assemble it yourself. It's served in a little bamboo tube so the presentation of this dish is on point ya'll. It comes with a side of mountain yam, seaweed and other greens. I've never had Mountain Yams before and by itself, it's definitely a little sticky like okra is, but paired with the tuna tartare, it added a very refreshing crunch like a radish. The tartare was a little salty on its own but definitely worked well with the yams and even more delicious if you had a little white rice to add to your seaweed wrap.

I'm pretty sure the servers are Japanese which makes this place even more legit and worth going to. I saw many Japanese customers finish their meal and hug and thank the owner for the friendly service. I love when small places like this are successful and it's obvious Kiraku is very popular amongst locals and even students. Looking forward to dining here again next time, but being smarter about it and checking Yelp waitlist before I arrive!",5.0
2019,"There is always a line. And for good reason.

The food here is amazing. Interesting, quality and well-executed. The menu looks different from any other Japanese restaurant you've been to. Always interesting and delicious - see the pics for what we tried this night.

Service is friendly and consistent. The space is small and compact so noise levels can be an issue, but the food really is worth it. GO. Enjoy.",5.0
2019,"I've heard only good things about this place, and I'm glad I finally tried it! I came here on a Thursday night around 7:15 with my boyfriend. We put our name on the yelp waitlist about 20 minutes before. Here's what we ordered:

Tuna cheek 5/5
Beef tongue skewer 5/5
Chicken karaage 4/5
Corn tempura 4/5
Tsunami sampler with seaweed, squid, octopus 2/5 - it was ok but probably wouldn't order again.

We ate 3 tacos before so we weren't that hungry, but the food was good! There's so much more I want to try. Definitely coming back!

Total for the 2 of us with 2 beers was around $80 after tip.",4.0
2019,"God I wish I went here before I graduated.

Heard so many good things about Kiraku, so finally gathered up a group of friends during our graduation week. Group of 8 came at 5pm to put our names on the waitlist, and we were seated right when they opened at 5:30!

For ease of ordering, we split the table by groups of 4 - my group ordered the corn tempura, jumbo squid, black pork belly, rice ball, chazuke, roasted duck, and finally finished with a dessert of blanc-manger.

Highlights of the night are the jumbo squid and roasted duck - so tender and melt in mouth bursting with flavor. All the other dishes were equally yummy; honestly I suspect any dish you order will be good.

Great service, a bit pricey (paid $40 per person) but definitely worth it. I definitely plan to come back again to try their other tapas.",5.0
2019,"Be prepared to splurge, because the menu has sooooo many good options. You will want to get everything... You have been warned.
Since it's Japanese tapas, you know that the portion is going to be small. For 3 people, order around 5-6 plates, depending on what the plates are. You can spend around $35-60 per person.

My all-time favorite are the grilled black cod, wagyu carpaccio and grilled tongue with truffle oil and sea salt. These three are a must-get. All three are super flavorful. The corn fritters with green tea salt is also great and crunchy. The roasted tea blanc-manger, which I still can't pronounce, is also a good dessert option. It's not super sweet, but it serves as a great palate cleanser.

If you make a reservation, they have a $40 minimum pp, but honestly, you wouldn't have a hard time hitting that. If you don't want to reserve, make sure you come early to put your name down or join the Yelp waitlist. Even if you join the Yelp waitlist at 5.30 (when it opens), you will get in at around 8.30. It's crazy!",5.0
2019,"I had an amazing dining experience at Kiraku! I am only deducting a star because they made us wait over 2 hours even after we had signed up on the waitlist and showed up when the message told us to check in with the host (we still waited an hour after that).

The restaurant itself is super small and kind of like an izakaya, so it was no wonder that the wait was so long. Their food is served on small plates, so do not walk in expecting to have one large dish that will fill you up. The menu has skewers, fried food, and other small plates that complement sake. We ordered a variety of dishes but my favorites were the pork belly skewers, the beef skewer, and the donburi. The pork belly is cut thickly, served with a miso paste and it reminded me of an elevated version of kbbq pork belly. Very tender and flavorful. The beef skewer was even more tender and deliciously seasoned, I would definitely recommend this one to anyone. The donburi is adorable and comes with the tiniest spoon. It is beautiful to look at and the ingredients served are fresh.

The other items we tried were the fried garlic (which also came with a miso paste), fried cartilage, onigiri, and sweet potato brulee. The garlic was not as garlicky as I hoped, so it was just fried batter. The fried cartilage had an interesting texture and was pretty good. The onigiri was probably my least favorite plate out of everything we ordered since I liked the donburi rice better. I think the onigiri could have been grilled a little longer for a more golden crust and texture. The sweet potato brulee was delicious and you can definitely feel the starchy texture and flavor. It is unique and a great end to a fantastic meal.

We ordered some sake and I loved that the employees helped us choose. They had sold out on some that we were interested in trying, but they let us sample a few to choose from the ones they had. I also loved that they let us pick our sake cups! There were so many different little cups to pick from (some cups were larger than others). The cups looked handmade and all had their own designs and quirks. Service was great and the food was a culinary adventure. I would love to come back and try the other items of their menu!",4.0
2019,"Sorry to be the naysayer here, but we dine all over the Bay Area and Kiraku disappointed us. Quality is excellent but portions stingy and concept/execution wasn't remarkable. Service however is excellent!

There were dishes that we liked - the salmon sashimi was excellent, the corn tempura precisely what it should be. The black cod was very fine but grossly overpriced for the incredibly skimpy size. The pork belly skewer was tasty, if rich (2/3 fat to 1/3 lean).

But the octopus dishes, both cooked and raw were simply unpleasant. The eggplant was an oily mess. The duck w/tare and sirloin yakitori were blandly generic, while the tongue showed the weaknesses of Japanese cuisine in seasoning and technique. The simmered (braised) pork was good, but a modest competitor 15 min away does the same dish better and cheaper.

The roasted tea blanc-manger was pleasing, but not remarkable enough to be destination-worthy. Also, texture was more like agar-agar than cornstarch (this is a dessert essentially unchanged from Medieval Europe days).

Although we tried 13 dishes, we didn't find enough to be worth a return, nor to justify ever standing in line - which we didn't. If you make a reservation with a $40/pp minimum - easy to do here, with tiny portions and high prices - you can simply walk in past the crowd.",2.0
2019,"You can't go wrong with anything on the menu, but here are some favorites:
- wagyu beef tataki
- jumbo squid
- roast duck
- corn tempura
- salmon carpaccio

Waitlist on Yelp before heading over!",5.0
2019,"Order again:
A5 Wagyu nigiri, damn good, thin slice, but well marbled.
Beef tongue skewer, meaty with some bits of fat, I like this texture.
5 type sashimi, fresh, good, could order again.

Maybe order again:
Corn tempura, 2 pieces, I remember this being more crunchy and awesome. Still good now. Something different.
Yuba, not bad, but not sure if the tofu skin helps the roe and uni flavors at all.
Canadian pork kakuni, soft tender pieces, fat well rendered, egg not too tasty.
Premium angus beef tongue, bigger plate than I imagined, truffle oil and salt brings out flavors, tender.
Beef intestine skewer, very meltttty fatty piece outside and intestine is chewy, super well charred, very fragrant fat smell.",5.0
2019,"This place is well deserving of its 4.5 stars aggregated rating and all the glowing reviews! Do prepare to drop some major dough $$ though. For the two of us, we spent close to $100 for 1 sparkling sake + a bunch of izakaya dishes. I think we did over-order by one dish though as we were super stuffed.

My mom and I came 10 minutes before opening and there was hardly a wait. Even after 30 minutes past opening time, there were still a handful of tables left. Maybe we came on a good day? If you can, try to avoid sitting right by the door as you would get the stench of urine from the wind blowing in smells through the open door.

We wound up getting the:

Suzuki (5/5): Super amazing. Would definitely order again. The sauce was perfection.

Pork Belly Skewer (4/5): Right ratio of fat and meat. A bit salty though. Depending on how I feel, I might skip this

Beef Tongue w/ truffle oil and Sea Salt (5/5): Very tender and the perfect amount of done. Perfectly seasoned. You can definitely taste and smell the truffle oil.

Scallop Skewer (3/5): I am meh on the dish, but my mom really enjoyed it. There wasn't much flavor imo and the scallops were a bit tough.

Yuba Spoons (4/5): Only complaint is that I wish they gave me more uni as the eggs overwhelmed any other taste

Eggplant (3/5): Nothing special about it. The sauce was a bit too sweet for me.

Can't wait to come back and try the rest of the menu!",5.0
2019,"They don't take reservations but you can sign up on their wait list from Yelp.  Expect a very long wait. On a weekend on opening time at 5:30PM, when we checked it gave us an estimate of 7:45PM. Street parking can be challenging but doable if you're willing to walk a few blocks.

But if you can put up with the wait, you're in for a treat. The restaurant is not that big, can can only seat about 35 to 40 people (one restroom stall). Without a doubt, the food here is fresh. Their fish collar is not what you expect.. it is HUGE and can easily be shared between 6 to 10 people. Grill Octopus was excellent. The Wagyu Carpaccio was strange as we had two orders but both order the Wagyu have different colors and texture. Excellent varieties of Saki.

Service was a bit unique as this is one of the place I can recall that impose a per person service charge for cutting a birthday cake. Also there's a small surcharge for credit card usage.",5.0
2019,"Everything here is really good, but I didn't really find anything that blew my mind away. None the less, you should try this restaurant for the uniqueness of the items on their menu. There aren't a lot of other places in the Bay that serves what they have.

This is a really small restaurant. ""Rubbing shoulders with your neighbor"" is a literal saying here.

If you're going to use Yelp waitlist to get a table, you need to tell them when you arrive or else they will assume you're not there. They don't bother calling your name until you check in here. This is how I got my table given away to the party after me :( Other than this, service was friendly and attentive.

This is what my party of 2 ate:

- Corn tempura: Tastes like what it sounds like
- Spicy jellyfish: Love this! Really fresh and flavorful.
- Beef tongue skewer: This was the most disappointing item. Some pieces of it were over done, so the beef had a tough/stringy texture
- Clam & cilantro ramen: Clear-ish broth soup and it wasn't really heavy. Loved this!!
- chicken cartilage: Taste and texture is what you'd expect. The batter was really light and this was perfectly fried too
- black cod: really good, but didn't taste too different than when I had this dish elsewhere
- Kyoto beer: I already want another one
- Aged plum wine: delish & refreshing

Total bill was around $90+tip.",4.0
2019,"My work Grub Club's conquest tonight was the highly-rated Japanese yakitori spot in Berkeley, which has been on my bookmarks list for a while.

Arrived right when it opened at 5:30p and there was already a line to get in.  The dining area was intimate and became packed about 30-45 min into our dinner.

My coworkers and I ordered a variety of food and  each dish was executed so well.

- tempura corn fritters- whimsical with a nice crunch and sweet corn flavor
-garlic edamame- savory and fresh
- beef tongue skewers - super tender and tasty
- pork belly skewers- delicious with the miso paste
- albacore ceviche -  bright and refreshing
- clam and cilantro ramen- flavorful depth of broth
- agedashi cod- umami notes
- salmon roe fried rice - salty goodness
- rice balls with shiso leaf - perfect to accompany the proteins
- blue fin tuna kama (OMG this was my favorite dish. Huge collar bone with the most tender flaky meat.  Takes 30 min to make so order right away.  $40 and so worth it, especially with a big group.
- Sochu samplers - I liked the Tekkan (distilled from sweet potato and rice) and Kanokko (distilled from barley and similar to whiskey)

We were pretty stuffed by the end of the meal and our bill was about $56 each for 5 of us.  Not bad considering all of the scrumptious food we consumed.  What an amazingly delectable meal!  I would definitely return with friends who love Japanese ""tapas.""",5.0
2019,"Loved every bite of the food. There's so much flavor in every single bite, I did not want to leave even though I was stuffed.

Make sure to order these:
Corn fritters - Trust me it's really good. It's not regular corn tempura.
Foie gras with rice - melty goodness...
Beef tongue - cooked to right temperature.",5.0
2019,"This is the first time I had Japanese food in the US. Kiraku is at a good price, convenient place, the services are nice as well. I like their food very much, especially for the beef tongue.
But then, I do think it's necessary for the staff to higher their voice as it's quick noisy there and I could barely hear what they say when I get my menu. Hence, I do think it's a little bit difficult for us to read the menu without a photo as many of the names are named with Japanese English that we are not easy to understand. This greatly slower our ordering speed.
Overall, I do think this is a good restaurant and I recommend you all to try.",4.0
2019,"Came on a Thursday night at around opening and quite shocked that we didn't have to wait since I've heard so much hype around the restaurant.

The vicinity is a small place but they're really smart with their table arrangements. Service is nice.

We were given a warm hand towel to begin our night.

We ordered:

- chefs choice of three: tuna, salmon and scallop. Definitely would order this again!! So fresh and good. 5/5

- beef tataki: thinly sliced pieces, aesthetically pleasing but I've definitely had better. 4/5

- corn tempura: wasn't expecting to like this as much as I did but wow!! Yum!! 5/5

- kaison don: the bowl is definitely a lot smaller than I thought, maybe 3x3"" in diameter and half of it was rice. Though the contents were great, I did expect more. 4.5/5

- Canadian pork belly with runny egg: MUST ORDER THIS. This was my favorite thing. 5/5

- sweet potato fries: we had to ask for a tempura sauce because it just felt like it was missing something. 3.5/5

- yaki udon comes with octopus and basil sauce: compared to the other orders, this bowl seemed ginormous. But if you compared this bowl size to any other restaurant, then it would be a regular sized bowl.

Overall, would definitely come again!",4.0
2019,"I've come here quite a few times since I've discovered this place two years ago and it's quickly become my favorite tapas place. Me and my boyfriend went on a rainy night at opening and were seated right away. And when we left an hour and a half later, there was only one couple waiting. What a life. I'll be coming here on rainy nights only from now on just to avoid a wait.

*** Loves ***
- Yuba: These are magical spoonfuls of uni and ikura. The taste of ocean but not too much ocean just explodes as soon as you put it in your mouth :')

- Corn Tempura: I can't even describe how good these are. I could order 5 of these and be happy.

- Shime Saba: Torched pieces of makerel sashi, super decadent and the torched part gives it the perfect amount of smoky flavor.

- Black Cod: Butterygoodness

*** Mehs***
- Grilled Beef Tongue: I would recommend getting either the skewer or the truffle beef tongue over this. It's less flavorful than the other two and a little more chewy imo.

- Snow crab Broccolini with Uni: I was excited for this one, but I thought it was a little too bitter. There's also very little snow crab.

Overall, you can't really go wrong with most of the dishes here. Since you'll be ordering a bunch of dishes, there's bound to be something that you fall in love with.",5.0
2019,"I correct my rating. I would give it 1.5 stars. Looking back, I felt the food wasn't that great. It didn't really taste that authentic. It feels more adapted to the American palette than being an authentic Japanese restaurant. The uni and wagyu nigiri combo seemed really confusing to the palette. I would prefer enjoying each separately.",2.0
2019,"One of my favorite spots of all-time in Berkeley. When I think great food scene to introduce to an out-of-town friend, Kiraku is one of few restaurants immediately on the tip of my tongue.

Reason being? Everything I've ordered at Kiraku has been a success. I have yet to be disappointed by Kiraku's menu. Granted, I've only been there for a total of 4-5 times, but I have oftentimes tried to veer away from repeating favorites too often and try new things. The fact that Kiraku is a tapas restaurant, which invites people to share and talk over that complementary hot sake and bit of sashimi, makes eating there a wonderful dining experience from beginning to end.

The wait is worth it if you're a fan of Japanese food. I also like Ippuku on Center St. but Kiraku is hard to beat, thanks to its fantastic menu and cheery, loud ambiance.",5.0
